title,price,rating,reviews,availability
Symbol Premium Men's Wrinkle-Resistant Regular Fit Cotton Formal Shirt,"1,699",3.9 out of 5 stars,192,In stock
GLORYBOYZ Men's Full Sleeve Checkered Shirt for Men Regular Fit Fashion Cotton Big Checks Shirt Button Down Collar Flannel Checked Shirt Formal Office Casual Wear (S - 6XL),854,3.7 out of 5 stars,166 ratings,In stock
Lee Men Shirt,"1,200",Previous page,,In stock
Parx Men's Pure Cotton Checks Pattern Slim Fit Semi Cutaway Collar Full Sleeve Casual Shirt,899,Previous page,,In stock
CB-COLEBROOK Men's Regular Fit Solid Soft Touch Cotton Casual Shirt with Pocket Design with Spread Collar & Full Sleeves,495,3.9 out of 5 stars,825 ratings,In stock
GRECIILOOKS Men Solid Regular Fit Casual Shirt (Pack of 1),479,4.1 out of 5 stars,312,Only 1 left in stock.
Lymio Casual Shirt for Men|| Shirt for Men|| Men Stylish Shirt (D-Crush-16-23),379,4.0 out of 5 stars,472 ratings,In stock
Amazon Brand - Symbol Men's Cotton Solid Full Sleeve Casual Shirt (Available in Plus Size),649,4.1 out of 5 stars,266 ratings,In stock
Amazon Brand - Symbol Men's Regular Fit Casual Shirt,799,3.9 out of 5 stars,"2,254 ratings",In stock
Symbol Premium Men's Allday Fresh Buttondown Oxford Shirt: Regular Fit,"1,699",4.2 out of 5 stars,125,In stock
TOPLOT Men's Solid Slim Fit Cotton Blend Casual Shirt with Spread Collar & Full Sleeves,439,4.4 out of 5 stars,471,Only 2 left in stock.
Majestic Man Printed Slim Fit Casual Shirt for Men,458,4.1 out of 5 stars,257 ratings,In stock
Lymio Casual Shirt for Men|| Shirt for Men|| Men Stylish Shirt (Rib-Shirt),479,4.2 out of 5 stars,166 ratings,In stock
IndoPrimo Men's Regular Fit Checks Cotton Casual Shirt for Men Full Sleeves - Suzuki,494,3.4 out of 5 stars,914 ratings,In stock
Bellstone Men Solid Cotton Blend Straight Kurta Shirt,495,3.2 out of 5 stars,170 ratings,In stock
Leriya Fashion Textured Shirts for Men || Casual Shirt for Men || Shirt for Men|| Men Stylish Shirt || Men Fancy Shirt || Men Full Sleeve Shirt || Plain Shirts for Men,439,3.9 out of 5 stars,159 ratings,Available to ship in 1-2 days
Dennis Lingo Men's Solid Slim Fit Cotton Casual Shirt with Spread Collar & Full Sleeves (Also Available in Plus Size),499,3.8 out of 5 stars,"36,666 ratings",In stock
Majestic Man Small Checkered Slim fit Cotton Casual Shirt,458,4.2 out of 5 stars,64,Only 1 left in stock.
IndoPrimo Men's Cotton Casual Regular Fit Green Checks Shirt for Men Full Sleeves - Harley,494,3.4 out of 5 stars,131 ratings,In stock
IndoPrimo Men's Western Fit Cotton Casual Bold Striped Shirt for Men Full Sleeves - Spelnder,494,3.8 out of 5 stars,159 ratings,In stock
IndoPrimo Men's Cotton Casual Regular Fit Small Checks Shirt with Pocket for Men Long Sleeves - BMW,494,3.3 out of 5 stars,715,In stock
Leriya Fashion Textured Shirts for Men || Casual Shirt for Men || Shirt for Men|| Men Stylish Shirt || Men Fancy Shirt || Men Half Sleeve Shirt || Plain Shirts for Men,409,3.6 out of 5 stars,32 ratings,In stock
IndoPrimo Men's Classic Fit Cotton Casual Super Striped Shirt for Men Full Sleeves - Yahama,494,3.8 out of 5 stars,128 ratings,In stock
Dennis Lingo Men's Checkered Slim Fit Cotton Casual Shirt,574,3.8 out of 5 stars,"3,979 ratings",In stock
Majestic Man Men Slim Fit Casual Shirt,458,3.8 out of 5 stars,759 ratings,In stock
Allen Solly Men's Slim Fit Shirt,"1,044",3.7 out of 5 stars,"14,672",In stock
Lee Men Shirt,"1,200",Previous page,,In stock
Allen Solly Men's Shirt,"1,209",3.7 out of 5 stars,8,In stock
Allen Solly Men's Regular Fit Shirt,967,3.9 out of 5 stars,431 ratings,In stock
GRECIILOOKS Men Regular Fit Casual Shirt,479,3.8 out of 5 stars,158 ratings,In stock
U-TURN Men's Cotton Solid Formal/Semi Formal Shirt,418,3.6 out of 5 stars,382 ratings,In stock
Miraan Men's Long Sleeve Casual Denim Shirt (SIGDENIM),589,3.8 out of 5 stars,"1,732 ratings",In stock
OTUS Men's Cotton Casual/Formal Slim Fit Solid Shirt,418,3.5 out of 5 stars,"1,376",In stock
IndoPrimo Men's Classic Fit Casual Shirt,594,3.7 out of 5 stars,"4,145",In stock
Leriya Fashion Shirt for Men | Tropical Leaf Printed Rayon Shirts for Men | Preppy Short Sleeves | Spread Collared Neck | Perfect for Outing | Beach | Camp Wear Shirt for Boys,289,3.6 out of 5 stars,"1,353 ratings",In stock
Peter England Men's Regular Fit Shirt,829,4.1 out of 5 stars,515 ratings,In stock
Dennis Lingo Men's Solid Slim Fit Casual Shirt,700,3.7 out of 5 stars,"2,682 ratings",In stock
Zartha Men Solid Cotton Blend Straight Kurta Shirt,595,3.9 out of 5 stars,12,In stock
"Dennis Lingo Men's Solid Slim Fit Casual Shirt, Full Sleeve Shirt for Casual Wear & Formal Wear (Also Available in Plus Size)",499,3.9 out of 5 stars,"13,799",Only 1 left in stock.
U-TURN Men's Cotton Solid Formal/Semi Formal Shirt,418,3.4 out of 5 stars,"1,521",In stock
Van Heusen Men's Casual Shirt,829,3.7 out of 5 stars,"2,263 ratings",In stock
Majestic Man Slim Fit Cotton Casual Check Shirt for Men,458,3.9 out of 5 stars,"2,095",In stock
BAD BOYZ CLUB BBC - Cotton Classic: Men's Casual Plain Shirt for Every Occasion,645,4.5 out of 5 stars,7 ratings,In stock
Dennis Lingo Men's Mandarin Collar Casual Shirt (Also Available in Plus Size),499,4.0 out of 5 stars,"20,198",Only 2 left in stock.
U-TURN Casual Shirt for Men|| Shirt for Men|| Men Stylish Shirt || Men Printed Striped Shirt,428,3.7 out of 5 stars,632,In stock
Allen Solly Men's Slim Fit Shirt,"1,044",3.7 out of 5 stars,"14,672",In stock
Lymio Casual Shirt for Men|| Shirt for Men|| Men Stylish Shirt || Men Printed Shirt (Crush-Lining),429,3.7 out of 5 stars,48 ratings,Only 4 left in stock.
OCTAVIAN Lycra Blend Comfortable & Breathable Full Sleeves Shirt for Men,399,3.1 out of 5 stars,23,In stock
U.S. POLO ASSN. Men Men's Casual Shirts,"1,299",4.1 out of 5 stars,242 ratings,In stock
The Modern Soul Stripe Self Design Oversized Tshirt for Men | Oversize T-Shirts for Men | Men Drop Shoulder Tshirts | Bagy Fit Mens Tshirt,379,Previous page,,
The Indian Garage Co Men Shirt,542,3.4 out of 5 stars,39 ratings,Only 4 left in stock.
Amazon Brand - INKAST Men's Slim Fit Casual Shirt,399,3.8 out of 5 stars,"2,150 ratings",In stock
Allen Solly Men's Shirt,"1,044",3.9 out of 5 stars,"7,555 ratings",In stock
IndoPrimo Men's Cotton Casual Solid Shirt for Men Full Sleeves,499,5.0 out of 5 stars,6,Only 5 left in stock.
OTUS Men's Cotton Printed Casual/Party Shirt,418,3.6 out of 5 stars,316 ratings,In stock
Majestic Man Slim Fit Satin Cotton Formal Shirt for Men,628,4.0 out of 5 stars,131,In stock
Dennis Lingo Men's Checkered Slim fit Casual Shirt,674,4.0 out of 5 stars,"5,674",In stock
Leriya Fashion Textured Shirts for Men || Casual Shirt for Men || Shirt for Men|| Men Stylish Shirt || Men Fancy Shirt || Men Half Sleeve Shirt || Plain Shirts for Men || Shirts,439,3.5 out of 5 stars,82 ratings,In stock
Amazon Brand - INKAST Men's Cotton Solid Full Sleeve Slim Fit Casual Shirt (Available in Plus Size),849,3.9 out of 5 stars,"18,323 ratings",In stock
Men Shirt|| Shirt for Men|| Casual Shirt for Men (Line Patta),349,4.8 out of 5 stars,12 ratings,Only 1 left in stock.
Allen Solly Men's Regular Fit Polo,699,4.1 out of 5 stars,"68,230 ratings",In stock
Allen Solly Men's Shirt,"1,044",3.9 out of 5 stars,"7,555 ratings",In stock
Dennis Lingo Men's Cotton Checkered Button Down Slim Fit Casual Shirt (Also Available in Plus Size),575,3.9 out of 5 stars,"1,732",Only 2 left in stock.
Pinkmint Cotton Soild Combo Men Shirt Formmal Wear Office Wear Regular Fit Shirt,599,Previous page,,In stock
Wrangler Men's Shirt,"1,439",5.0 out of 5 stars,1 rating,Only 1 left in stock.
Amazon Brand - Symbol Men's Regular Fit Casual Shirt,799,3.9 out of 5 stars,"2,254 ratings",In stock
Symbol Premium Men's Allday Fresh Buttondown Oxford Shirt: Regular Fit,"1,699",4.2 out of 5 stars,125 ratings,In stock
Raymond Men's Regular Fit Causual Shirt(RMSV11510-G7_Grey),"2,474",4.1 out of 5 stars,2 ratings,In stock
Park Avenue Blue Print Slim Fit Formal Shirts for Men,"1,439",5.0 out of 5 stars,1 rating,In stock
Pinkmint Mens Long Sleeve Button Down Shirt for Men Collared Casual Formal Soild Shirt,349,4.3 out of 5 stars,29,In stock
